{
  "acceptance_checks": [
    {
      "criterion": "value <= 0.0002",
      "description": "The unchanged soft-wall verifier remains within tolerance.",
      "id": "soft-wall-existing-verifier",
      "passed": true,
      "value": 3.103071401063436e-05
    },
    {
      "criterion": "value <= 0.0005",
      "description": "Hard-wall shooting ratios reproduce Bessel-zero ratios.",
      "id": "hard-wall-analytic-ratios",
      "passed": true,
      "value": 4.931330928929469e-08
    },
    {
      "criterion": "value <= 0.001",
      "description": "Shooting and collocation agree on their common ratios.",
      "id": "hard-wall-independent-solvers",
      "passed": true,
      "value": 3.047716708578713e-11
    },
    {
      "description": "All three decreasing UV cutoffs reduce the ratio error.",
      "id": "hard-wall-cutoff-refinement",
      "passed": true
    }
  ],
  "comparison": "soft-wall-hard-wall-vector-ratios",
  "descriptive_comparisons": [
    {
      "chi_square": 572.6043041418698,
      "chi_square_per_dof": 286.3021520709349,
      "covariance": "frozen reference-data ratio covariance",
      "degrees_of_freedom": 2,
      "entries": [
        {
          "included_in_chi_square": false,
          "model_mode": 0,
          "residual": 0.0
        },
        {
          "included_in_chi_square": true,
          "model_mode": 1,
          "residual": -0.47547998936046465
        },
        {
          "included_in_chi_square": true,
          "model_mode": 2,
          "residual": -0.48657266199368254
        }
      ],
      "is_acceptance_gate": false,
      "model_id": "quadratic-soft-wall"
    },
    {
      "chi_square": 3016.770507578708,
      "chi_square_per_dof": 1508.385253789354,
      "covariance": "frozen reference-data ratio covariance",
      "degrees_of_freedom": 2,
      "entries": [
        {
          "included_in_chi_square": false,
          "model_mode": 0,
          "residual": 0.0
        },
        {
          "included_in_chi_square": true,
          "model_mode": 1,
          "residual": 0.40572870339506517
        },
        {
          "included_in_chi_square": true,
          "model_mode": 2,
          "residual": 1.3798743207506199
        }
      ],
      "is_acceptance_gate": false,
      "model_id": "hard-wall"
    }
  ],
  "excluded_entries": [
    {
      "assignment_status": "ambiguous",
      "id": "rho-1570",
      "label": "rho(1570)",
      "model_mode": 2,
      "reason": "Considered as an alternative n=2 assignment but excluded from the default comparison: PDG omits rho(1570) from the Summary Table and states that it may be an OZI-violating decay mode of rho(1700).",
      "source_artifact": "rho-1570-listing",
      "source_locator": "rho(1570) MASS, BABAR 08S listing",
      "uncertainty": {
        "combination": "Components are retained separately because this excluded entry is not used in the default covariance calculation.",
        "components": [
          {
            "label": "statistical",
            "sigma": 36.0
          },
          {
            "label": "systematic",
            "sigma": 62.0
          }
        ],
        "kind": "components",
        "source_text": "1570 +/- 36 +/- 62 MeV",
        "unit": "MeV"
      },
      "unit": "MeV",
      "value": 1570.0
    }
  ],
  "interpretation_limits": [
    "The PDG excited-state assignments are candidate phenomenological labels.",
    "Goodness-of-comparison values are descriptive and are not model acceptance gates.",
    "Agreement does not prove QCD duality or precision-model validity.",
    "The comparison does not rank either construction outside this selected observable."
  ],
  "model_predictions": [
    {
      "calibration": "m_0 is normalized to the rho(770)^0 anchor",
      "construction": "dilaton Phi(z) = kappa^2 z^2 on fixed AdS5",
      "entries": [
        {
          "analytic_ratio": 1.0,
          "model_mode": 0,
          "numerical_absolute_error": 0.0,
          "ratio": 1.0
        },
        {
          "analytic_ratio": 1.4142135623730951,
          "model_mode": 1,
          "numerical_absolute_error": 4.931141758257596e-06,
          "ratio": 1.4142086312313369
        },
        {
          "analytic_ratio": 1.7320508075688772,
          "model_mode": 2,
          "numerical_absolute_error": 1.2938901878145614e-05,
          "ratio": 1.732037868666999
        }
      ],
      "id": "quadratic-soft-wall",
      "label": "Quadratic soft wall",
      "schema_version": "0.3",
      "solver_provenance": {
        "formulation": "second-order centered finite-difference eigenproblem",
        "independent_check": "exact analytic spectrum",
        "primary_library_function": "scipy.linalg.eigvalsh_tridiagonal",
        "settings": {
          "dimensionless_z_max": 10.0,
          "grid_points": 1200
        }
      },
      "source_reference": "Karch et al., arXiv:hep-ph/0602229v2, Eqs. (8)-(15)"
    },
    {
      "calibration": "m_0 is normalized to the rho(770)^0 anchor",
      "construction": "fixed AdS5 slice with a phenomenological IR wall",
      "entries": [
        {
          "analytic_ratio": 1.0,
          "model_mode": 0,
          "numerical_absolute_error": 0.0,
          "ratio": 1.0
        },
        {
          "analytic_ratio": 2.295417267427694,
          "model_mode": 1,
          "numerical_absolute_error": 5.6559172900705335e-08,
          "ratio": 2.2954173239868667
        },
        {
          "analytic_ratio": 3.5984846739581138,
          "model_mode": 2,
          "numerical_absolute_error": 1.774531876996832e-07,
          "ratio": 3.5984848514113015
        }
      ],
      "id": "hard-wall",
      "label": "Hard wall",
      "schema_version": "0.3",
      "solver_provenance": {
        "formulation": "adaptive shooting with an IR Neumann residual",
        "independent_check": "scipy.integrate.solve_bvp global collocation",
        "primary_library_function": "scipy.integrate.solve_ivp + scipy.optimize.root_scalar",
        "settings": {
          "epsilon_fraction": 0.0001,
          "integration_atol": 1e-11,
          "integration_rtol": 1e-09,
          "root_rtol": 1e-10
        }
      },
      "source_reference": "Erlich et al., arXiv:hep-ph/0501128v2, Eq. (5)"
    }
  ],
  "numerical_validation": {
    "hard_wall_cross_solver_max_relative_difference": 3.047716708578713e-11,
    "hard_wall_cutoff_refinement": {
      "improves_at_every_level": true,
      "interpretation": "This sequence estimates finite-cutoff effects; integration, root, and collocation tolerances remain separate settings.",
      "levels": [
        {
          "epsilon_fraction": 0.01,
          "mass_ratios": [
            1.0,
            2.2959782017936985,
            3.6002324223965356
          ],
          "max_ratio_relative_error": 0.0004856901159174401
        },
        {
          "epsilon_fraction": 0.003,
          "mass_ratios": [
            1.0,
            2.295468106835546,
            3.5986440464527805
          ],
          "max_ratio_relative_error": 4.428877961327745e-05
        },
        {
          "epsilon_fraction": 0.001,
          "mass_ratios": [
            1.0,
            2.295422921062656,
            3.5985024109780936
          ],
          "max_ratio_relative_error": 4.9290247387267936e-06
        }
      ],
      "method": "shooting"
    }
  },
  "passed": true,
  "reference": {
    "anchor_index": 0,
    "conventions": [
      {
        "name": "mass representation",
        "rationale": "The comparison must not mix pole and Breit-Wigner conventions silently.",
        "value": "PDG listed mass; rho(770)^0 uses the listed Breit-Wigner mass"
      },
      {
        "name": "default radial assignment",
        "rationale": "The default reproduces a common phenomenological assignment but does not treat either excited-state label as exact.",
        "value": "rho(770)^0 is the anchor; rho(1450) and rho(1700) are candidate radial excitations"
      },
      {
        "name": "rho(1570) sensitivity alternative",
        "rationale": "PDG lists rho(1570) but omits it from the Summary Table and notes that it may be an OZI-violating decay mode of rho(1700), so it cannot be assumed to be an independent radial state.",
        "value": "rho(1570) is recorded as an excluded, ambiguous alternative for model mode n=2"
      },
      {
        "name": "comparison observable",
        "rationale": "Ratios remove the one dimensionful scale from each bottom-up construction.",
        "value": "R_n = m_n / m_0"
      },
      {
        "name": "source covariance",
        "rationale": "The frozen PDG listings do not provide a covariance matrix; the shared denominator correlation is then generated explicitly by the ratio Jacobian.",
        "value": "Listed mass uncertainties are treated as mutually independent before ratio normalization"
      }
    ],
    "dataset_id": "pdg-2026-rho-masses",
    "edition": {
      "accessed_on": "2026-08-05",
      "artifacts": [
        {
          "id": "rho-770-listing",
          "sha256": "ffd2af7d831a568bf4af14f80eb68b1329aca6072c1ef6b4a8de4e380a77cec9",
          "url": "https://pdg.lbl.gov/2026/listings/rpp2026-list-rho-770.pdf"
        },
        {
          "id": "rho-1450-listing",
          "sha256": "5b08adabf11dcc7d77863d20a5ee0a2f5de7cd008c23f008dfdf86d968901784",
          "url": "https://pdg.lbl.gov/2026/listings/rpp2026-list-rho-1450.pdf"
        },
        {
          "id": "rho-1570-listing",
          "sha256": "4e53faf5a47fe7b6501bf639614886a211a9ed6ec3f01a2ee7bb537af70bdbcc",
          "url": "https://pdg.lbl.gov/2026/listings/rpp2026-list-rho-1570.pdf"
        },
        {
          "id": "rho-1700-listing",
          "sha256": "07e50c4994fc4dd82b4b9a102252acc0e6665ddfea0b4045ad9ea8637ab2bb01",
          "url": "https://pdg.lbl.gov/2026/listings/rpp2026-list-rho-1700.pdf"
        }
      ],